[
  {
    "id": "quick-tests",
    "name": "Run test suite",
    "description": "Run npm test quickly",
    "command": "npm test",
    "tags": ["test"]
  },
  {
    "id": "install-lodash",
    "name": "Install lodash",
    "description": "Install lodash dependency",
    "command": "npm install lodash",
    "tags": ["npm", "deps"]
  },
  {
    "id": "lint-src",
    "name": "Lint source",
    "description": "Run ESLint on src",
    "command": "npx eslint src",
    "tags": ["lint"]
  }
]
